{
  "tool_name": "query_order",
  "version": "1.0.0",
  "side_effect_level": "READ_ONLY",
  "input_schema": {
    "type": "object",
    "additionalProperties": false,
    "required": [
      "order_id"
    ],
    "properties": {
      "order_id": {
        "type": "string",
        "minLength": 1
      }
    }
  }
}
